<?xml version="1.0"?>
<!DOCTYPE CheckPoint SYSTEM "checkpoint.dtd" >
<CheckPoint>
  <DefaultStop>660</DefaultStop>
  <FirstPrime>607</FirstPrime>
  <MaxCount>10</MaxCount>
  <CurrentPrimeCount>255</CurrentPrimeCount>
  <CurrentPrime>2</CurrentPrime>
  <CurrentPrime>3</CurrentPrime>
  <CurrentPrime>5</CurrentPrime>
  <CurrentPrime>7</CurrentPrime>
  <CurrentPrime>11</CurrentPrime>
  <CurrentPrime>13</CurrentPrime>
  <CurrentPrime>17</CurrentPrime>
  <CurrentPrime>19</CurrentPrime>
  <CurrentPrime>23</CurrentPrime>
  <CurrentPrime>29</CurrentPrime>
  <CurrentPrime>31</CurrentPrime>
  <CurrentPrime>37</CurrentPrime>
  <CurrentPrime>41</CurrentPrime>
  <CurrentPrime>43</CurrentPrime>
  <CurrentPrime>47</CurrentPrime>
  <CurrentPrime>53</CurrentPrime>
  <CurrentPrime>59</CurrentPrime>
  <CurrentPrime>61</CurrentPrime>
  <CurrentPrime>67</CurrentPrime>
  <CurrentPrime>71</CurrentPrime>
  <CurrentPrime>73</CurrentPrime>
  <CurrentPrime>79</CurrentPrime>
  <CurrentPrime>83</CurrentPrime>
  <CurrentPrime>89</CurrentPrime>
  <CurrentPrime>97</CurrentPrime>
  <CurrentPrime>101</CurrentPrime>
  <CurrentPrime>103</CurrentPrime>
  <CurrentPrime>107</CurrentPrime>
  <CurrentPrime>109</CurrentPrime>
  <CurrentPrime>113</CurrentPrime>
  <CurrentPrime>127</CurrentPrime>
  <CurrentPrime>131</CurrentPrime>
  <CurrentPrime>137</CurrentPrime>
  <CurrentPrime>139</CurrentPrime>
  <CurrentPrime>149</CurrentPrime>
  <CurrentPrime>151</CurrentPrime>
  <CurrentPrime>157</CurrentPrime>
  <CurrentPrime>163</CurrentPrime>
  <CurrentPrime>167</CurrentPrime>
  <CurrentPrime>173</CurrentPrime>
  <CurrentPrime>179</CurrentPrime>
  <CurrentPrime>181</CurrentPrime>
  <CurrentPrime>191</CurrentPrime>
  <CurrentPrime>193</CurrentPrime>
  <CurrentPrime>197</CurrentPrime>
  <CurrentPrime>199</CurrentPrime>
  <CurrentPrime>211</CurrentPrime>
  <CurrentPrime>223</CurrentPrime>
  <CurrentPrime>227</CurrentPrime>
  <CurrentPrime>229</CurrentPrime>
  <CurrentPrime>233</CurrentPrime>
  <CurrentPrime>239</CurrentPrime>
  <CurrentPrime>241</CurrentPrime>
  <CurrentPrime>251</CurrentPrime>
  <CurrentPrime>257</CurrentPrime>
  <CurrentPrime>263</CurrentPrime>
  <CurrentPrime>269</CurrentPrime>
  <CurrentPrime>271</CurrentPrime>
  <CurrentPrime>277</CurrentPrime>
  <CurrentPrime>281</CurrentPrime>
  <CurrentPrime>283</CurrentPrime>
  <CurrentPrime>293</CurrentPrime>
  <CurrentPrime>307</CurrentPrime>
  <CurrentPrime>311</CurrentPrime>
  <CurrentPrime>313</CurrentPrime>
  <CurrentPrime>317</CurrentPrime>
  <CurrentPrime>331</CurrentPrime>
  <CurrentPrime>337</CurrentPrime>
  <CurrentPrime>347</CurrentPrime>
  <CurrentPrime>349</CurrentPrime>
  <CurrentPrime>353</CurrentPrime>
  <CurrentPrime>359</CurrentPrime>
  <CurrentPrime>367</CurrentPrime>
  <CurrentPrime>373</CurrentPrime>
  <CurrentPrime>379</CurrentPrime>
  <CurrentPrime>383</CurrentPrime>
  <CurrentPrime>389</CurrentPrime>
  <CurrentPrime>397</CurrentPrime>
  <CurrentPrime>401</CurrentPrime>
  <CurrentPrime>409</CurrentPrime>
  <CurrentPrime>401</CurrentPrime>
  <CurrentPrime>409</CurrentPrime>
  <CurrentPrime>401</CurrentPrime>
  <CurrentPrime>409</CurrentPrime>
  <CurrentPrime>419</CurrentPrime>
  <CurrentPrime>421</CurrentPrime>
  <CurrentPrime>431</CurrentPrime>
  <CurrentPrime>433</CurrentPrime>
  <CurrentPrime>439</CurrentPrime>
  <CurrentPrime>419</CurrentPrime>
  <CurrentPrime>421</CurrentPrime>
  <CurrentPrime>431</CurrentPrime>
  <CurrentPrime>433</CurrentPrime>
  <CurrentPrime>439</CurrentPrime>
  <CurrentPrime>419</CurrentPrime>
  <CurrentPrime>421</CurrentPrime>
  <CurrentPrime>431</CurrentPrime>
  <CurrentPrime>433</CurrentPrime>
  <CurrentPrime>439</CurrentPrime>
  <CurrentPrime>419</CurrentPrime>
  <CurrentPrime>421</CurrentPrime>
  <CurrentPrime>431</CurrentPrime>
  <CurrentPrime>433</CurrentPrime>
  <CurrentPrime>439</CurrentPrime>
  <CurrentPrime>419</CurrentPrime>
  <CurrentPrime>421</CurrentPrime>
  <CurrentPrime>431</CurrentPrime>
  <CurrentPrime>433</CurrentPrime>
  <CurrentPrime>439</CurrentPrime>
  <CurrentPrime>419</CurrentPrime>
  <CurrentPrime>421</CurrentPrime>
  <CurrentPrime>431</CurrentPrime>
  <CurrentPrime>433</CurrentPrime>
  <CurrentPrime>439</CurrentPrime>
  <CurrentPrime>419</CurrentPrime>
  <CurrentPrime>421</CurrentPrime>
  <CurrentPrime>431</CurrentPrime>
  <CurrentPrime>433</CurrentPrime>
  <CurrentPrime>439</CurrentPrime>
  <CurrentPrime>419</CurrentPrime>
  <CurrentPrime>421</CurrentPrime>
  <CurrentPrime>431</CurrentPrime>
  <CurrentPrime>433</CurrentPrime>
  <CurrentPrime>439</CurrentPrime>
  <CurrentPrime>419</CurrentPrime>
  <CurrentPrime>421</CurrentPrime>
  <CurrentPrime>431</CurrentPrime>
  <CurrentPrime>433</CurrentPrime>
  <CurrentPrime>439</CurrentPrime>
  <CurrentPrime>419</CurrentPrime>
  <CurrentPrime>421</CurrentPrime>
  <CurrentPrime>431</CurrentPrime>
  <CurrentPrime>433</CurrentPrime>
  <CurrentPrime>439</CurrentPrime>
  <CurrentPrime>419</CurrentPrime>
  <CurrentPrime>421</CurrentPrime>
  <CurrentPrime>431</CurrentPrime>
  <CurrentPrime>433</CurrentPrime>
  <CurrentPrime>439</CurrentPrime>
  <CurrentPrime>419</CurrentPrime>
  <CurrentPrime>421</CurrentPrime>
  <CurrentPrime>431</CurrentPrime>
  <CurrentPrime>433</CurrentPrime>
  <CurrentPrime>439</CurrentPrime>
  <CurrentPrime>419</CurrentPrime>
  <CurrentPrime>421</CurrentPrime>
  <CurrentPrime>431</CurrentPrime>
  <CurrentPrime>433</CurrentPrime>
  <CurrentPrime>439</CurrentPrime>
  <CurrentPrime>443</CurrentPrime>
  <CurrentPrime>449</CurrentPrime>
  <CurrentPrime>457</CurrentPrime>
  <CurrentPrime>461</CurrentPrime>
  <CurrentPrime>463</CurrentPrime>
  <CurrentPrime>467</CurrentPrime>
  <CurrentPrime>479</CurrentPrime>
  <CurrentPrime>487</CurrentPrime>
  <CurrentPrime>491</CurrentPrime>
  <CurrentPrime>499</CurrentPrime>
  <CurrentPrime>503</CurrentPrime>
  <CurrentPrime>509</CurrentPrime>
  <CurrentPrime>521</CurrentPrime>
  <CurrentPrime>523</CurrentPrime>
  <CurrentPrime>541</CurrentPrime>
  <CurrentPrime>547</CurrentPrime>
  <CurrentPrime>557</CurrentPrime>
  <CurrentPrime>563</CurrentPrime>
  <CurrentPrime>569</CurrentPrime>
  <CurrentPrime>443</CurrentPrime>
  <CurrentPrime>449</CurrentPrime>
  <CurrentPrime>457</CurrentPrime>
  <CurrentPrime>461</CurrentPrime>
  <CurrentPrime>463</CurrentPrime>
  <CurrentPrime>467</CurrentPrime>
  <CurrentPrime>479</CurrentPrime>
  <CurrentPrime>487</CurrentPrime>
  <CurrentPrime>491</CurrentPrime>
  <CurrentPrime>499</CurrentPrime>
  <CurrentPrime>503</CurrentPrime>
  <CurrentPrime>509</CurrentPrime>
  <CurrentPrime>521</CurrentPrime>
  <CurrentPrime>523</CurrentPrime>
  <CurrentPrime>541</CurrentPrime>
  <CurrentPrime>547</CurrentPrime>
  <CurrentPrime>557</CurrentPrime>
  <CurrentPrime>563</CurrentPrime>
  <CurrentPrime>569</CurrentPrime>
  <CurrentPrime>443</CurrentPrime>
  <CurrentPrime>449</CurrentPrime>
  <CurrentPrime>457</CurrentPrime>
  <CurrentPrime>461</CurrentPrime>
  <CurrentPrime>463</CurrentPrime>
  <CurrentPrime>467</CurrentPrime>
  <CurrentPrime>479</CurrentPrime>
  <CurrentPrime>487</CurrentPrime>
  <CurrentPrime>491</CurrentPrime>
  <CurrentPrime>499</CurrentPrime>
  <CurrentPrime>503</CurrentPrime>
  <CurrentPrime>509</CurrentPrime>
  <CurrentPrime>521</CurrentPrime>
  <CurrentPrime>523</CurrentPrime>
  <CurrentPrime>541</CurrentPrime>
  <CurrentPrime>547</CurrentPrime>
  <CurrentPrime>557</CurrentPrime>
  <CurrentPrime>563</CurrentPrime>
  <CurrentPrime>569</CurrentPrime>
  <CurrentPrime>443</CurrentPrime>
  <CurrentPrime>449</CurrentPrime>
  <CurrentPrime>457</CurrentPrime>
  <CurrentPrime>461</CurrentPrime>
  <CurrentPrime>463</CurrentPrime>
  <CurrentPrime>467</CurrentPrime>
  <CurrentPrime>479</CurrentPrime>
  <CurrentPrime>487</CurrentPrime>
  <CurrentPrime>491</CurrentPrime>
  <CurrentPrime>499</CurrentPrime>
  <CurrentPrime>503</CurrentPrime>
  <CurrentPrime>509</CurrentPrime>
  <CurrentPrime>521</CurrentPrime>
  <CurrentPrime>523</CurrentPrime>
  <CurrentPrime>541</CurrentPrime>
  <CurrentPrime>547</CurrentPrime>
  <CurrentPrime>557</CurrentPrime>
  <CurrentPrime>563</CurrentPrime>
  <CurrentPrime>569</CurrentPrime>
  <CurrentPrime>577</CurrentPrime>
  <CurrentPrime>587</CurrentPrime>
  <CurrentPrime>593</CurrentPrime>
  <CurrentPrime>599</CurrentPrime>
  <CurrentPrime>601</CurrentPrime>
  <CurrentPrime>607</CurrentPrime>
  <CurrentPrime>577</CurrentPrime>
  <CurrentPrime>587</CurrentPrime>
  <CurrentPrime>593</CurrentPrime>
  <CurrentPrime>599</CurrentPrime>
  <CurrentPrime>601</CurrentPrime>
  <CurrentPrime>607</CurrentPrime>
  <CurrentPrime>577</CurrentPrime>
  <CurrentPrime>587</CurrentPrime>
  <CurrentPrime>593</CurrentPrime>
  <CurrentPrime>599</CurrentPrime>
  <CurrentPrime>601</CurrentPrime>
  <CurrentPrime>607</CurrentPrime>
  <CurrentPrime>577</CurrentPrime>
  <CurrentPrime>587</CurrentPrime>
  <CurrentPrime>593</CurrentPrime>
  <CurrentPrime>599</CurrentPrime>
  <CurrentPrime>601</CurrentPrime>
  <CurrentPrime>607</CurrentPrime>
  <CurrentPrime>577</CurrentPrime>
  <CurrentPrime>587</CurrentPrime>
  <CurrentPrime>593</CurrentPrime>
  <CurrentPrime>599</CurrentPrime>
  <CurrentPrime>601</CurrentPrime>
  <CurrentPrime>607</CurrentPrime>
</CheckPoint>
